{
  "id": "api-factory",
  "meta": {
    "name": "api-factory",
    "path": "/workspaces/api-factory",
    "owner": "",
    "lastUpdated": "2025-09-09T05:08:13.540Z"
  },
  "repo": {
    "provider": "github",
    "authenticated": true,
    "repoUrl": "https://github.com/FutureWealthBot/api-factory",
    "headSha": "9d7457670f1723d052cc145948a31b38bd945e71",
    "defaultBranch": "main",
    "ci": {
      "provider": "github-actions",
      "status": "completed",
      "conclusion": "failure"
    }
  },
  "hosting": {
    "provider": "vercel",
    "authenticated": false
  },
  "db": {
    "provider": "supabase",
    "authenticated": false
  },
  "summary": {
    "health": "unknown",
    "risks": [],
    "wins": [],
    "milestones": []
  }
}